PT;AU;BA;BE;GP;AF;BF;CA;TI;SO;SE;BS;LA;DT;CT;CY;CL;SP;HO;DE;ID;AB;C1;RP;RI;OI;FU;FX;CR;NR;TC;Z9;U1;U2;PU;PI;PA;SN;EI;BN;J9;JI;PD;PY;VL;IS;PN;SU;SI;MA;BP;EP;AR;DI;D2;EA;PG;WC;SC;GA;UT;PM;OA;HC;HP;DA
J;"Lewin, HA; Robinson, GE; Kress, WJ; Baker, WJ; Coddington, J; Crandall, KA; Durbin, R; Edwards, SV; Forest, F; Gilbert, MTP; Goldstein, MM; Grigoriev, IV; Hackett, KJ; Haussler, D; Jarvis, ED; Johnson, WE; Patrinos, A; Richards, S; Castilla-Rubio, JC; van Sluys, MA; Soltis, PS; Xu, X; Yang, HM; Zhang, GJ";;;;"Lewin, Harris A.; Robinson, Gene E.; Kress, W. John; Baker, William J.; Coddington, Jonathan; Crandall, Keith A.; Durbin, Richard; Edwards, Scott V.; Forest, Felix; Gilbert, M. Thomas P.; Goldstein, Melissa M.; Grigoriev, Igor V.; Hackett, Kevin J.; Haussler, David; Jarvis, Erich D.; Johnson, Warren E.; Patrinos, Aristides; Richards, Stephen; Castilla-Rubio, Juan Carlos; van Sluys, Marie-Anne; Soltis, Pamela S.; Xu, Xun; Yang, Huanming; Zhang, Guojie";;;Earth BioGenome Project: Sequencing life for the future of life;PROCEEDINGS OF THE NATIONAL ACADEMY OF SCIENCES OF THE UNITED STATES OF AMERICA;;;English;Article;;;;;;"biodiversity; genome sequencing; access and benefit sharing; genomics; data science";"GENOMICS; TREE; PHYLOGENY; KNOWLEDGE";Increasing our understanding of Earth's biodiversity and responsibly stewarding its resources are among the most crucial scientific and social challenges of the new millennium. These challenges require fundamental new knowledge of the organization, evolution, functions, and interactions among millions of the planet's organisms. Herein, we present a perspective on the Earth BioGenome Project (EBP), a moonshot for biology that aims to sequence, catalog, and characterize the genomes of all of Earth's eukaryotic biodiversity over a period of 10 years. The outcomes of the EBP will inform a broad range of major issues facing humanity, such as the impact of climate change on biodiversity, the conservation of endangered species and ecosystems, and the preservation and enhancement of ecosystem services. We describe hurdles that the project faces, including data-sharing policies that ensure a permanent, freely available resource for future scientific discovery while respecting access and benefit sharing guidelines of the Nagoya Protocol. We also describe scientific and organizational challenges in executing such an ambitious project, and the structure proposed to achieve the project's goals. The far-reaching potential benefits of creating an open digital repository of genomic information for life on Earth can be realized only by a coordinated international effort.;"[Lewin, Harris A.] Univ Calif Davis, Dept Ecol & Evolut, Davis, CA 95616 USA; [Lewin, Harris A.] Univ Calif Davis, Sch Vet Med, Dept Populat Hlth & Reprod, Davis, CA 95616 USA; [Lewin, Harris A.] Univ Calif Davis, John Muir Inst Environm, Davis, CA 95616 USA; [Lewin, Harris A.] Univ Calif Davis, Davis Genome Ctr, Davis, CA 95616 USA; [Robinson, Gene E.] Univ Illinois, Dept Entomol & Neurosci Program, Carl R Woese Inst Genom Biol, Urbana, IL 61801 USA; [Kress, W. John; Coddington, Jonathan] Smithsonian Inst, Natl Museum Nat Hist, Washington, DC 20013 USA; [Baker, William J.] Royal Bot Gardens, Kew, Richmond TW9 3AE, Surrey, England; [Crandall, Keith A.] George Washington Univ, Computat Biol Inst, Milken Inst Sch Publ Hlth, Washington, DC 20052 USA; [Durbin, Richard] Univ Cambridge, Dept Genet, Cambridge CB10 1SA, England; [Durbin, Richard] Wellcome Trust Sanger Inst, Cambridge CB10 1SA, England; [Edwards, Scott V.] Harvard Univ, Dept Organism & Evolutionary Biol, Cambridge, MA 02138 USA; [Edwards, Scott V.] Harvard Univ, Museum Comparat Zool, Cambridge, MA 02138 USA; [Gilbert, M. Thomas P.] Univ Copenhagen, Nat Hist Museum Denmark, DK-1350 Copenhagen, Denmark; [Gilbert, M. Thomas P.] Norwegian Univ Sci & Technol, Univ Museum, N-7491 Trondheim, Norway; [Goldstein, Melissa M.] George Washington Univ, Milken Inst Sch Publ Hlth, Dept Hlth Policy & Management, Washington, DC 20052 USA; [Grigoriev, Igor V.] US Dept Energy Joint Genome Inst, Walnut Creek, CA 94598 USA; [Grigoriev, Igor V.] Univ Calif Berkeley, Dept Plant & Microbial Biol, Berkeley, CA 94720 USA; [Hackett, Kevin J.] USDA, Agr Res Ctr, Beltsville, MD 20705 USA; [Haussler, David] Univ Calif Santa Cruz, UC Santa Cruz Genom Inst, Santa Cruz, CA 95064 USA; [Haussler, David] Univ Calif Santa Cruz, Howard Hughes Med Inst, Santa Cruz, CA 95064 USA; [Jarvis, Erich D.] Rockefeller Univ, Lab Neurogenet Language, New York, NY 10065 USA; [Johnson, Warren E.] Smithsonian Inst, Natl Zool Pk, Conservat Biol Inst, Front Royal, VA 22630 USA; [Patrinos, Aristides] Univ Calif Santa Barbara, Novim Grp, Santa Barbara, CA 93106 USA; [Richards, Stephen] Baylor Coll Med, Human Genome Sequencing Ctr, Houston, TX 77030 USA; [Castilla-Rubio, Juan Carlos] World Econ Forums Global Future Council Environm, CH-1223 Cologny Geneva, Switzerland; [Castilla-Rubio, Juan Carlos] Space Time Ventures, BR-05449050 Sao Paulo, SP, Brazil; [van Sluys, Marie-Anne] Univ Sao Paulo, Inst Biociencia, Dept Bot, BR-05508090 Sao Paulo, SP, Brazil; [van Sluys, Marie-Anne] Sao Paulo Res Fdn FAPESP, BR-05468901 Sao Paulo, SP, Brazil; [Soltis, Pamela S.] Univ Florida, Florida Museum Nat Hist, Gainesville, FL 32611 USA; [Xu, Xun; Zhang, Guojie] BGI Shenzhen, China Natl Genebank, Shenzhen 518083, Guangdong, Peoples R China; [Yang, Huanming] BGI Shenzhen, Shenzhen 518083, Guangdong, Peoples R China; [Zhang, Guojie] Univ Copenhagen, Dept Biol, Sect Ecol & Evolut, DK-2100 Copenhagen, Denmark; [Zhang, Guojie] Chinese Acad Sci, Kunming Inst Zool, State Key Lab Genet Resources & Evolut, Kunming 650223, Yunnan, Peoples R China";"Lewin, HA (reprint author), Univ Calif Davis, Dept Ecol & Evolut, Davis, CA 95616 USA.; Lewin, HA (reprint author), Univ Calif Davis, Sch Vet Med, Dept Populat Hlth & Reprod, Davis, CA 95616 USA.; Lewin, HA (reprint author), Univ Calif Davis, John Muir Inst Environm, Davis, CA 95616 USA.; Lewin, HA (reprint author), Univ Calif Davis, Davis Genome Ctr, Davis, CA 95616 USA.";"Durbin, Richard/AAE-7178-2019; /H-2789-2019; Jarvis, Erich D/A-2319-2008; Zhang, Guojie/B-6188-2014; Van Sluys, Marie-Anne/A-8483-2012; Gilbert, Marcus/A-8936-2013; Johnson, Warren/D-4149-2016";"Durbin, Richard/0000-0002-9130-1006; /0000-0002-0836-3389; Jarvis, Erich D/0000-0001-8931-5049; Zhang, Guojie/0000-0001-6860-1521; Van Sluys, Marie-Anne/0000-0002-6506-2734; Gilbert, Marcus/0000-0002-5805-7195; Trizna, Michael/0000-0002-0537-8382; Grigoriev, Igor/0000-0002-3136-8903; Coddington, Jonathan A./0000-0001-6004-7730; Johnson, Warren/0000-0002-5954-186X";"Howard Hughes Medical InstituteHoward Hughes Medical Institute; Wellcome TrustWellcome Trust [207492/Z/17/Z]";;;44;68;68;8;55;NATL ACAD SCIENCES;WASHINGTON;2101 CONSTITUTION AVE NW, WASHINGTON, DC 20418 USA;0027-8424;;;P NATL ACAD SCI USA;Proc. Natl. Acad. Sci. U. S. A.;Apr-24;2018;115;17;;;;;4325;4333;;10.1073/pnas.1720115115;;;9;Multidisciplinary Sciences;Science & Technology - Other Topics;GD7MZ;WOS:000430697500045;29686065;Green Published, Bronze;Y;N;07/02/2020
J;Caldas, M;;;;Caldas, Mariel;;;Reflections on Digital Technologies as Pastoral Places of Communion Walking from the Connection to Communion and Empowerment;TEOLOGIA;;;Spanish;Article;;;;;;"Digital Technologies; Pastoral Places; Communion; Empowerment";;"If we have as a basis that ""the proclamation of the Gospel can not do without the current culture (which) must be known, evaluated and in a certain sense assumed by the Church, with a language understood by our contemporaries"" (DA 480), the announcement in Digital technologies must be present in our pastoral praxis, not only as a means or tool but as a pastoral environment or place that generates communion and can lead to empowerment. In all human environments where technology is present, to move from the connection to communion, this space will have more to do with the encounter between people and Jesus Christ, and between them in themselves, than with the technological use; and in this way, ""the digital network can be a place rich in humanity: not a network of cables, but human persons"".";[Caldas, Mariel] Univ Salesiana Bahia Blanca, Bahia Blanca, Buenos Aires, Argentina;Caldas, M (reprint author), Univ Salesiana Bahia Blanca, Bahia Blanca, Buenos Aires, Argentina.;;;;;;24;0;0;0;0;PONTIFICIA UNIV CATOLICA ARGENTINA, FAC TEOLOGIA;BUENOS AIRES;CONCORDIA 4422, BUENOS AIRES, C1419AOH, ARGENTINA;0328-1396;;;TEOLOGIA;Teologia;APR;2018;55;125;;;;;139;152;;;;;14;Religion;Religion;HM7HM;WOS:000459648800009;;;;;07/02/2020
J;Lopes, APL;;;;Leme Lopes, Andre Pereira;;;Digital turn? Historical research on cyberspace;TEMPO E ARGUMENTO;;;English;Article;;;;;;"Historical Research; Bibliographical Research; Bibliographical Research on Line; Search Tools on the Web";AGE;The growth of the use of computers and the Internet among new generations of students took the academic world by surprise. Historians haven't been unaware of these developments and little by little learned to use the new technologies to their advantage. Here I intend to argue that the emergence of the World Wide Web allowed history researchers to significantly change their practices of investigation. I will not talk about the history produced on the web or the so-called Digital Humanities but I'll focus only on the research phase of the historiographical operation.;[Leme Lopes, Andre Pereira] Univ Brasilia UnB, Brasilia, DF, Brazil;Lopes, APL (reprint author), Univ Brasilia UnB, Brasilia, DF, Brazil.;;;;;;63;0;0;0;2;UNIV ESTADO SANTA CATARINA-UDESC;FLORIANOPOLIS;RUA VISCONDE OURO PRETO 457, CENTRO, FLORIANOPOLIS, SC 88020-04, BRAZIL;2175-1803;;;TEMPO ARGUM;Tempo Argum.;APR-JUN;2018;10;24;;;;;136;169;;10.5965/2175180310242018136;;;34;History;History;GP4XC;WOS:000440874700008;;DOAJ Gold;;;07/02/2020
J;"Agarwal, V; Kumar, P";;;;"Agarwal, Vaibhav; Kumar, Parteek";;;A public platform for developing language-independent applications;DIGITAL SCHOLARSHIP IN THE HUMANITIES;;;English;Article;;;;;;;PUNJABI;This article describes the research and development (R&D) work done as an extension to the multilingual cross-domain client application prototype for UNL-ization and NL-ization for natural language processing (NLP) application developed by Agarwal and Kumar (A multilingual cross-domain client application prototype for UNL-ization and NL-ization for NLP applications. Digital Scholarship in the Humanities, 2016) 1. A common platform has been developed and made live for worldwide users where they can share their Interactive Analyzer and EUGENE (dEep-to-sUrface GENErator) resources and exploit already shared resources by other users for UNL-ization and NL-ization. This article also highlights that how the existing platform can be used by other researchers and developers to make their UNL-based Web applications language-independent and can make it available to computational linguists, researchers, developers, and general audience globally. Such kind of platform is definitely useful for all UNL-based R&D activities being done throughout the geography. The platform gives 100% accuracy. However, the correctness depends on the F-measure of the respective Analysis and Generation module being used.;"[Agarwal, Vaibhav; Kumar, Parteek] Thapar Univ, CSED, Patiala 951303003, Punjab, India";Agarwal, V (reprint author), Thapar Univ, CSED, Patiala 951303003, Punjab, India.;;;;;;28;1;1;1;5;OXFORD UNIV PRESS;OXFORD;GREAT CLARENDON ST, OXFORD OX2 6DP, ENGLAND;2055-7671;2055-768X;;DIGIT SCHOLARSH HUM;Digit. Scholarsh. Humanit.;APR;2018;33;1;;;;;1;5;;10.1093/llc/fqw063;;;5;"Humanities, Multidisciplinary; Linguistics";"Arts & Humanities - Other Topics; Linguistics";GE2XV;WOS:000431078900001;;;;;07/02/2020
J;Hixson, E;;;;Hixson, Elijah;;;A Lost Page of Codex Bezae: Traces of the Bezan Greek Text of Acts 10.4-9;NEW TESTAMENT STUDIES;;;English;Article;;;;;;"Codex Bezae; D-text; Western text; Acts; textual criticism; digital humanities";;Codex Bezae lacks the Greek text of Acts 10.4-14, but the Latin text survives on fol. 455a. Damage to the manuscript has caused traces of ink from the now-lost Greek text to be transferred onto the Latin page of Acts 10.4-14. They preserve a mirror image of text from fol. 454b, the facing page at the time of the damage. By reversing high-resolution images of fol. 455a with photo-editing software, the offset ink can be deciphered. As a result, the surviving Greek text from Acts 10.4-9 in Codex Bezae is published here for the first time.;[Hixson, Elijah] Univ Edinburgh, New Coll, Mound Pl, Edinburgh EH1 2LX, Midlothian, Scotland;Hixson, E (reprint author), Univ Edinburgh, New Coll, Mound Pl, Edinburgh EH1 2LX, Midlothian, Scotland.;;;;;;30;0;0;0;2;CAMBRIDGE UNIV PRESS;NEW YORK;32 AVENUE OF THE AMERICAS, NEW YORK, NY 10013-2473 USA;0028-6885;1469-8145;;NEW TESTAMENT STUD;New Testam. Stud.;APR;2018;64;2;;;;;213;230;;10.1017/S0028688517000339;;;18;Religion;Religion;FY7EZ;WOS:000427025700006;;;;;07/02/2020
J;"Martinez-Solis, L; Chain-Navarro, C";;;;"Martinez-Solis, Lorena; Chain-Navarro, Celia";;;Digital Humanities for learning and dissemination of the Naval Heritage;RED-REVISTA DE EDUCACION A DISTANCIA;;;Spanish;Article;;;;;;"Innovation teaching; e-innovation; ubiquitous learning; technology 2.0; Digital Humanities; Teaching; Postgraduate; Master; blog; social networks; web 2.0; Naval History; Naval Heritage";BLOGS;Innovating practices on the network at university education are considered with great interest, but there are academic areas where it is more difficult to implement them. Therefore, our goal was to bring them to teaching practice, using ubiquitous systems, in a Postgraduate Humanities. We assume that it could be a new way of learning not only contents, but also digital tools, and these competences would help students to acquire and important autonomy degree on the management of virtual resources, which would also be of great usefulness on the working market. To achieve it, we chose the platforms with greater use and adaptability, such as Wordpress for blogs and Facebook and Twitter for social networks. The results of the surveys confirm the high level of satisfaction on the part of the students and the perception that with this system they have learned in a different way.;"[Martinez-Solis, Lorena; Chain-Navarro, Celia] Univ Murcia, Murcia, Spain";Martinez-Solis, L (reprint author), Univ Murcia, Murcia, Spain.;Chain-Navarro, Celia/Z-5429-2019;;;;;54;0;0;0;1;EDIT UM-EDICIONES UNIV MURCIA;MURCIA;EDIFICIO SAAVEDRA FAJARDO, C/O ACTOR ISIDORO MAIQUEZ 9, MURCIA, 30007, SPAIN;1578-7680;;;RED-REV EDUC DISTANC;RED-Rev. Educ. Distancia;Mar-31;2018;;57;;;SI;;;;9;10.6018/red/57/9;;;19;Education & Educational Research;Education & Educational Research;HC3JX;WOS:000451699400010;;DOAJ Gold;;;07/02/2020
J;Burman, JT;;;;Burman, Jeremy Trevelyan;;;What Is History of Psychology? Network Analysis of Journal Citation Reports, 2009-2015;SAGE OPEN;;;English;Article;;;;;;"history of psychology; network analysis; digital humanities; science studies; publishing";"AMERICAN PSYCHOLOGY; FUTURE; IMPACT; PHILOSOPHY; PAGERANK";"This essay considers the History of Psychology-its interests and boundaries-using the data behind the Journal Impact Factor system. Advice is provided regarding what journals to follow, which broad frames to consider in presenting research findings, and where to publish the resulting studies to reach different audiences. The essay itself has also been written for those with only passing familiarity with its methods. It is therefore not necessary to be an expert in network analysis to engage in ""virtual witnessing"" while considering methods or results: Everything is clearly explained and carefully illustrated. The further consequence is that those who are new to the History of Psychology as a specialty, distinct from its subject matter, are introduced to the myriad historical perspectives within and related to psychology from the broadest possible perspective. A supplemental set of exemplary readings is also provided, in addition to cited references, drawing from identified sources from beyond the primary journals.";[Burman, Jeremy Trevelyan] Univ Groningen, Theory & Hist Psychol, Groningen, Netherlands;Burman, JT (reprint author), Univ Groningen, Fac Behav & Social Sci, Reflecting Psychol Grad Programme, Dept Theory & Hist Psychol, Grote Kruisstr 2-1, NL-9712 TS Groningen, Netherlands.;;Burman, Jeremy/0000-0002-4409-8260;;;;67;1;1;0;6;SAGE PUBLICATIONS INC;THOUSAND OAKS;2455 TELLER RD, THOUSAND OAKS, CA 91320 USA;2158-2440;;;SAGE OPEN;SAGE Open;Mar-16;2018;8;1;;;;;;;2,15824E+15;10.1177/2158244018763005;;;17;Social Sciences, Interdisciplinary;Social Sciences - Other Topics;FZ8BD;WOS:000427829300001;;DOAJ Gold, Green Published;;;07/02/2020
J;Schneiderman, C;;;;Schneiderman, Cate;;;Digital Humanities at Virginia Tech;LIBRARY JOURNAL;;;English;Editorial Material;;;;;;;;;;;;;;;;0;0;0;1;3;REED BUSINESS INFORMATION;NEW YORK;360 PARK AVENUE SOUTH, NEW YORK, NY 10010 USA;0363-0277;;;LIBR J;Libr. J.;Mar-15;2018;143;5;;;;;14;16;;;;;3;Information Science & Library Science;Information Science & Library Science;FZ7UC;WOS:000427808600014;;;;;07/02/2020
J;"Larionova, V; Brown, K; Bystrova, T; Sinitsyn, E";;;;"Larionova, Viola; Brown, Ken; Bystrova, Tatiana; Sinitsyn, Evgueny";;;Russian perspectives of online learning technologies in higher education: An empirical study of a MOOC;RESEARCH IN COMPARATIVE AND INTERNATIONAL EDUCATION;;;English;Article;;;;;;"Model of learning; online learning; blended learning; mass open online courses; MOOC; higher education; empirical study; educational process";;There has been a rapid growth of massive open online courses (MOOCs) in the global education market in the last decade. Online learning technologies are becoming increasingly widespread in the non-formal education sector and in higher and supplementary vocational education. The use of MOOCs in Russia to support the delivery of educational programmes at university level opens opportunities in terms of expanding the educational choice for students, the development of virtual academic mobility, reduction in the cost of educational services, and improvement in the accessibility of education. However, the effectiveness of using different online learning technologies at university level, and the consequences of their widespread adoption, has not been sufficiently explored. In this research study, a comparative analysis is made of the effects of different online learning models on student educational outcomes in a university setting. A study was undertaken in which different groups of students at the Ural Federal University, Russia, were encouraged to study technical and humanities disciplines using a framework of blended learning, and online learning with tutoring support. The results of the study were compared with the results of a reference (control) group of students who studied the same disciplines in a traditionally taught model. It was found that both models (blended and online) of MOOC implementation demonstrated greater learning gains, in comparison with the traditional model. For engineering and technical disciplines, there was no statistically significant difference between blended or online learning technologies. For the humanities discipline, where the communicative component of the learning process was significant, the blended learning technology produced better results. Conclusions of this empirical research may be useful for heads of educational organizations and teachers in helping them to make strategic decisions about the modernization of university courses by increasing the effectiveness of the implementation of new educational technologies. The results of this research project will be used for implementing the State Priority Project, 'The Modern Digital Educational Environment of the Russian Federation'.;"[Larionova, Viola] Ural Fed Univ, Acad Dept Econ & Management Construct & Real Esta, Grad Sch Econ & Management, 19 Mira St, Ekaterinburg 620002, Russia; [Bystrova, Tatiana] Ural Fed Univ, Acad Dept Cultural Studies & Design, Philosophy, Ekaterinburg, Russia; [Bystrova, Tatiana] Ural Fed Univ, Acad Dept Cultural Studies & Design, Ekaterinburg, Russia; [Sinitsyn, Evgueny] Ural Fed Univ, Acad Dept Syst & Decis Making Anal, Grad Sch Econ & Management, Phys & Math, Ekaterinburg, Russia; [Sinitsyn, Evgueny] Ural Fed Univ, Acad Dept Syst & Decis Making Anal, Grad Sch Econ & Management, Ekaterinburg, Russia; [Brown, Ken] Letterkenny Inst Technol, Sch Engn, Letterkenny, Ireland";Larionova, V (reprint author), Ural Fed Univ, Acad Dept Econ & Management Construct & Real Esta, Grad Sch Econ & Management, 19 Mira St, Ekaterinburg 620002, Russia.;"Larionova, Viola A/B-3171-2015; Pimentel, Priscilla/AAG-6402-2019";"Larionova, Viola A/0000-0002-2132-5176; Brown, Ken/0000-0001-8863-1410";Russian Scientific FoundationRussian Science Foundation (RSF) [15-18-10014];"The authors would like to express their deepest gratitude to the Russian Scientific Foundation for the support of the research within the project number 15-18-10014, ""Designing Optimal Social and Economic Systems in the Context of Turbulence of External and Internal Environment'.";;39;7;8;1;25;SAGE PUBLICATIONS LTD;LONDON;1 OLIVERS YARD, 55 CITY ROAD, LONDON EC1Y 1SP, ENGLAND;1745-4999;;;RES COMP INT EDUC;Res. Comp. Int. Educ.;MAR;2018;13;1;;;SI;;70;91;;10.1177/1745499918763420;;;22;Education & Educational Research;Education & Educational Research;GG3WM;WOS:000432624400005;;Bronze, Green Accepted;;;07/02/2020
J;Serna, RD;;;;De La Cruz Serna, Rafael;;;"Seminar ""History and Digital Humanities"". Ciudad Real, 7th-9th November 2017";REVISTA HISTORIA AUTONOMA;;;Spanish;Editorial Material;;;;;;;;;[De La Cruz Serna, Rafael] Univ Castilla La Mancha, Hist, Ciudad Real, Spain;Serna, RD (reprint author), Univ Castilla La Mancha, Hist, Ciudad Real, Spain.;;;;;;0;0;0;0;2;ASOC HISTORIA AUTONOMA;MADRID;TOMAS Y VALIENTE 1, MADRID, 28049, SPAIN;2254-8726;;;REV HIST AUTON;Rev. Hist. Auton.;MAR;2018;;12;;;;;335;338;;;;;4;History;History;GB6KG;WOS:000429177400025;;DOAJ Gold;;;07/02/2020
J;Fletcher, EH;;;;Fletcher, Erica Hua;;;"Uncivilizing ""Mental Illness"": Contextualizing Diverse Mental States and Posthuman Emotional Ecologies within The Icarus Project";JOURNAL OF MEDICAL HUMANITIES;;;English;Article;;;;;;"Critical posthumanism; Cultural ecology; Online narratives; Mad studies; Digital ethnography; Medical humanities";;"This article argues humans should not be defined strictly at their physical boundaries with clear distinctions between anatomical bodies, mental states, and the rest of the world. Rather, diverse mental states, which are often diagnosed as ""mental illness,"" take shape within greater environmental forces and flows, including those that are constructed online. Drawing from a multi-sited ethnography of The Icarus Project, a radical mental health community, the author situates online narratives written by two of its members within posthuman emotional ecologies in which the exchange of ideas online affects mental states in a profound way. These narratives can be seen as a new type of psychiatric resistance based in new technologies, one that ""uncivilizes"" mental illness by searching for alternative frameworks and metaphors to understand lived experiences with mental distress. This ethnographic perspective differs significantly from traditional bio-psychiatric models and interventions and can offer both patients and mental healthcare providers with an alternative language to frame mental health.";[Fletcher, Erica Hua] Univ Houston, Honors Coll, Houston, TX 77004 USA;Fletcher, EH (reprint author), Univ Houston, Honors Coll, Houston, TX 77004 USA.;;;Jeane B. Kempner Predoctoral Fellowship;I would like to thank FarAway, Faith, and other friends from The Icarus Project for their willingness to share stories and contribute to my dissertation research. I would also like to express my gratitude to Nicole Piemonte, Rebecca Hester, Jerome Crowder, Bradley Lewis, Sara Balabanlilar, S. Rodriguez, Austin Eldridge, and Dan Price for their thoughtful recommendations and advice regarding this paper. The Jeane B. Kempner Predoctoral Fellowship (2014-2015) provided financial support for this study. As always, this work would not be possible without Jung Hua Fletcher.;;21;1;1;2;4;SPRINGER;NEW YORK;233 SPRING ST, NEW YORK, NY 10013 USA;1041-3545;1573-3645;;J MED HUMANIT;J. Med. Humanit.;MAR;2018;39;1;;;SI;;29;43;;10.1007/s10912-017-9476-y;;;15;Humanities, Multidisciplinary;Arts & Humanities - Other Topics;GP4CA;WOS:000440803300004;28891019;;;;07/02/2020
