PT;AU;BA;BE;GP;AF;BF;CA;TI;SO;SE;BS;LA;DT;CT;CY;CL;SP;HO;DE;ID;AB;C1;RP;RI;OI;FU;FX;CR;NR;TC;Z9;U1;U2;PU;PI;PA;SN;EI;BN;J9;JI;PD;PY;VL;IS;PN;SU;SI;MA;BP;EP;AR;DI;D2;EA;PG;WC;SC;GA;UT;PM;OA;HC;HP;DA
J;Stangl, W;;;;Stangl, Werner;;;'THE EMPIRE STRIKES BACK'?: HGIS DE LAS INDIAS AND THE POSTCOLONIAL DEATH STAR;INTERNATIONAL JOURNAL OF HUMANITIES AND ARTS COMPUTING-A JOURNAL OF DIGITAL HUMANITIES;;;English;Article;;;;;;"Postcolonialism; historical GIS; spatial humanities; theory-practicedivide; database design; colonial Spanish America";;"This article serves a two-fold purpose: first, to give an overview of the project HGIS de las Indias, and second to ask for its relation with the epistemological currents in spatial humanities, thereby raising some fundamental thoughts and inquietudes about the relationship between projects designed for accommodating particular practical needs and overarching theory. In the first part, thus, we will sketch the initial impulse that made the project come to life; then, we will outline the basic structure, features, and general characteristics of the database and its web application, briefly commenting on how that database design correlates and conflicts with the ontologies of historical sources underlying the reconstruction process. In the second part, we will try to tackle the question of whether projects of such tailoring should have a place within the spatial humanities, which seem to have shifted or solidified their epistemological center in poststructuralist, postmodern, postcolonial, and neo-geographic discourses, advocating for a reflected employment of digital spatial tools focussing on their different roles within the humanities instead of enforcing a growing divide between a theoretical navel-gazing and an atheoretical practice.";;;;;;;;43;0;0;0;0;EDINBURGH UNIV PRESS;EDINBURGH;THE TUN-HOLYROOD RD, 12 2F JACKSONS ENTRY, EDINBURGH EH8 8PJ, SCOTLAND;1753-8548;1755-1706;;INT J HUMANIT ARTS C;Int. J. Humanit. Arts Comput.;OCT;2018;12;2;;;SI;;138;162;;10.3366/ijhac.2018.0219;;;25;"Humanities, Multidisciplinary; Computer Science, Interdisciplinary Applications";"Arts & Humanities - Other Topics; Computer Science";GX6BL;WOS:000447841600005;;;;;07/02/2020
J;Spence, P;;;;Spence, Paul;;;The academic book and its digital dilemmas;CONVERGENCE-THE INTERNATIONAL JOURNAL OF RESEARCH INTO NEW MEDIA TECHNOLOGIES;;;English;Article;;;;;;"Academic book; digital humanities; digital publishing; e-books; research publishing; scholarly communication; scholarly monograph; scholarly publishing; the future of the academic book";;The future of the academic book has been under debate for many years now, with academic institutional dynamics boosting output, while actual demand has moved in the opposite direction, leading to a reduced market which has felt like it is in crisis for some time. While journals have experienced widespread migration to digital, scholarly monographs in print form have been resilient and digital alternatives have faced significant problems of acceptance, particularly in the arts and humanities. Focusing in particular on the arts and humanities, this article asks how, and under what conditions, the digitally mediated long-form academic publication might hold a viable future. It examines digital disruption and innovation within humanities publishing, contrasts different models and outlines some of the key challenges facing scholarly publishing in the humanities. This article examines how non-traditional entities, such as digital humanities research projects, have performed digital publishing roles and reviews possible implications for scholarly book publishing's relationship to the wider research process. It concludes by looking at how digital or hybrid long-form publications might become more firmly established within the scholarly publishing landscape.;[Spence, Paul] Kings Coll London, Digital Humanities, London, England;Spence, P (reprint author), Kings Coll London, Dept Digital Humanities, London WC2R 2LS, England.;;Spence, Paul/0000-0001-9236-2727;;;;54;1;1;5;22;SAGE PUBLICATIONS INC;THOUSAND OAKS;2455 TELLER RD, THOUSAND OAKS, CA 91320 USA;1354-8565;1748-7382;;CONVERGENCE-US;Convergence;OCT;2018;24;5;;;SI;;458;476;;10.1177/1354856518772029;;;19;Communication;Communication;GV3OQ;WOS:000446005200003;;Green Published;;;07/02/2020
J;O'Sullivan, J;;;;O'Sullivan, James;;;The equivalence of books: Monographs, prestige, and the rise of edge cases;CONVERGENCE-THE INTERNATIONAL JOURNAL OF RESEARCH INTO NEW MEDIA TECHNOLOGIES;;;English;Article;;;;;;"Academic book of the future; academic books; digital humanities; digital publishing; edge cases; forms of scholarship; modes of production; publishing";;The digital has shifted the forms through which we present scholarship, and as academic projects become increasingly disconnected with the codex form, our conceptions of what constitutes an academic book warrants problematization. This is particularly so with edge cases', projects which look to collate, curate, and create thematically consistent critical insights on topics of relevance to the Arts and Humanities, using unfamiliar forms. This brief essay explores a selection of digital projects that might be classified as edge cases, interacting with relevant stakeholders through short surveys designed to determine why digital apparatus were favored. The purpose of this essay is to query whether such outliers can be considered, as exemplifiers of what is meant by an edge case, to be the equivalent of the academic book.;[O'Sullivan, James] Univ Coll Cork, Cork, Ireland;O'Sullivan, J (reprint author), Univ Coll Cork, Digital Humanities, 2-22 ORahilly Bldg,Western Rd, Cork, Ireland.;;;AHRC;A draft of this article was previously published as a report as part of the AHRC-funded Academic Book of the Future project (O'Sullivan, 2017). For a list of all reports and resources generated by the project, see: https://academicbookfuture.org/links-and-resources/.;;18;0;0;0;5;SAGE PUBLICATIONS INC;THOUSAND OAKS;2455 TELLER RD, THOUSAND OAKS, CA 91320 USA;1354-8565;1748-7382;;CONVERGENCE-US;Convergence;OCT;2018;24;5;;;SI;;494;503;;10.1177/1354856518780457;;;10;Communication;Communication;GV3OQ;WOS:000446005200005;;;;;07/02/2020
J;Gulum, E;;;;Gulum, Erol;;;Virtual Enviroment as a Digital Communication Technologies-Mediated Folkloric Experience Sphere;MILLI FOLKLOR;;;Turkish;Article;;;;;;"Folklore; internet; digital folklore; mediated cultural enviroment; digital humanities";;It is observed that virtual environment as a shared techno-social life space which is momently being reproduced through the convergence between digital communication technologies that work as relationship enabler in everyday use and Web 2.0 based interaction applications have turn into a efficient channel for the production, transmission and consumption of folklore besides expanding the performance scope of various offline cultural practices and activities. Especially, when the necessary condition of folklore is fixed the motive of human, the need of expressing oneself and creativity instead of face to face interactions, it becomes more evident that the virtual environment is a factor that can provide the sufficient condition for folkloric production. When dealt with in this context, it could be claimed that domesticated virtual environment in which or on which socio-cultural activities can be performed have evolved a new folkloric experience domain that makes possible the emergence of original and even authentic folkloric performances and productions. The aspects of this situation that directly interest folklore studies are that communication and interaction technologies in generally and Internet in particular anymore have become a main factor of folkloric production and that many new, creative and hybrid cultural expressions which have some folkloric qualities have emerged in the generated virtual contexts. Here, in this study which problematized whether virtual environment is appropriate for cultural production in general and folkloric production in particular will be discussed the folklorization of virtual environment rather than virtualization of folklore according to specified parametres. Hence, it will be tried to reveal how cultural environment and contexts that are generated through digital communication technology have turn into an area of experience which is almost equivalent to oral environment over time.;[Gulum, Erol] Bilecik Seyh Edebali Univ, Fen Edebiyat Fak, Turk Dili & Edebiyati Bolumu, Bilecik, Turkey;Gulum, E (reprint author), Bilecik Seyh Edebali Univ, Fen Edebiyat Fak, Turk Dili & Edebiyati Bolumu, Bilecik, Turkey.;;;;;;20;0;0;2;2;MILLI FOLKLOR DERGISI;ANKARA;PK 336, ANKARA, YENISEHR 06420, TURKEY;1300-3984;;;MILLI FOLKLOR;Milli Folklor;FAL;2018;;119;;;;;127;139;;;;;13;Folklore;Arts & Humanities - Other Topics;HB8RN;WOS:000451358400010;;;;;07/02/2020
J;"Salcedo, D; Bezerra, VCA";;;;"Salcedo, Diego; Accioly Bezerra, Vinicius Cabral";;;THE GENESIS OF THE BRAZILIAN PHILATELIC REPOSITORY: an interdisciplinary experience in the Digital Humanities;INFORMACAO & SOCIEDADE-ESTUDOS;;;Portuguese;Article;;;;;;"Digital Humanities; Memory; Postage Stamp; Repository; Web Semantics";SCIENCE;"It presents the project in progress entitled ""Brazilian Philatelic Repository - REFIBRA"". Explains the actions of digital curation carried out by the IMAGO Research Group linked to the Information Science Department of the Federal University of Pernambuco. The project aims to develop a digital repository of the brazilian philatelic documents produced since 1843. The article indicates applications of computational technologies articulated to the interdisciplinarity of the digital humanities. As a methodology, the bibliographical review makes use of some elements proposed in the specialized scientific literature of Library Studies, Information Science, Computing and Philately. It points out the criteria used until now to choose the most efficient and effective computational technology. It illustrates a preliminary proposal of semantic web application for the informational treatment of 32 commemorative postage stamps. It uses the Dublin Core metadata standard, with necessary adaptations, the Linked Data visualization system and the Resource Description Framework. The results obtained and published in this article collaborate with the advancement of the research and are evidence that the field of Digital Humanities articulate its self praising its interdisciplinary facet, but also learning about how a certain level of articulation of computational technologies with informational demands may result in high quality models.";"[Salcedo, Diego; Accioly Bezerra, Vinicius Cabral] Univ Fed Pernambuco, Programa Posgrad Ciencia Informacao, Recife, PE, Brazil";Salcedo, D (reprint author), Univ Fed Pernambuco, Programa Posgrad Ciencia Informacao, Recife, PE, Brazil.;;;;;;24;0;0;1;6;UNIV FEDERAL CAMPINA GRANDE;CAMPINA GRANDE PB;RUA APRIGIO VELOSO 882, BODO CONGO, CAMPINA GRANDE PB, 58109 090, BRAZIL;0104-0146;1809-4783;;INFORM SOC-ESTUD;Inf. Soc.-Estud.;SEP-DEC;2018;28;3;;;;;69;80;;;;;12;Information Science & Library Science;Information Science & Library Science;HF8MT;WOS:000454497100006;;;;;07/02/2020
J;"Alfano, M; Carter, JA; Cheong, M";;;;"Alfano, Mark; Carter, J. Adam; Cheong, Marc";;;Technological Seduction and Self-Radicalization;JOURNAL OF THE AMERICAN PHILOSOPHICAL ASSOCIATION;;;English;Article;;;;;;"technological seduction; virtue epistemology; digital humanities; dynamical systems theory; philosophy of technology; nudge";"TRANSACTIVE MEMORY; INTERNET; VALUES";"Many scholars agree that the Internet plays a pivotal role in self-radicalization, which can lead to behaviors ranging from lone-wolf terrorism to participation in white nationalist rallies to mundane bigotry and voting for extremist candidates. However, the mechanisms by which the Internet facilitates self-radicalization are disputed; some fault the individuals who end up self-radicalized, while others lay the blame on the technology itself. In this paper, we explore the role played by technological design decisions in online self-radicalization in its myriad guises, encompassing extreme as well as more mundane forms. We begin by characterizing the phenomenon of technological seduction. Next, we distinguish between top-down seduction and bottom-up seduction. We then situate both forms of technological seduction within the theoretical model of dynamical systems theory. We conclude by articulating strategies for combating online self-radicalization.";"[Alfano, Mark] Delft Univ Technol, Delft, Netherlands; [Alfano, Mark] Australian Catholic Univ, Sydney, NSW, Australia; [Carter, J. Adam] Univ Glasgow, Glasgow, Lanark, Scotland; [Cheong, Marc] Monash Univ, Clayton, Vic, Australia";Carter, JA (reprint author), Univ Glasgow, Glasgow, Lanark, Scotland.;;Carter, J Adam/0000-0002-1222-8331;;;;80;1;1;5;11;CAMBRIDGE UNIV PRESS;NEW YORK;32 AVENUE OF THE AMERICAS, NEW YORK, NY 10013-2473 USA;2053-4477;2053-4485;;J AM PHILOS ASSOC;J. Am. Philos. Assoc.;FAL;2018;4;3;;;;;298;322;;10.1017/apa.2018.27;;;25;Philosophy;Philosophy;HF5UM;WOS:000454299600003;;Green Accepted;;;07/02/2020
J;Mahony, S;;;;Mahony, Simon;;;Cultural Diversity and the Digital Humanities;FUDAN JOURNAL OF THE HUMANITIES AND SOCIAL SCIENCES;;;English;Article;;;;;;"Digital humanities; Cultural diversity; Multi-lingualism; Community; Globalism";;"Digital humanities has grown and changed over the years; we have moved away from expecting technology to be a tool to make humanities research easier and faster into one where we are now equal partners. Our collaborative projects drive forward the research agendas of both humanists and technologists. There have been other changes too. The focus of our scholarly interest has moved away from its historical origins in text-based scholarship, although that now has many more possibilities, and we are seeing an interest in exploring culture and heritage more widely. Where the progress is slower is in our moves towards openness and inclusivity, and this is to some extent hampered by a lack of linguistic diversity. This is being addressed with specialist groups within the major DH organizations on a national and a global level. DH has grown rapidly in China, and the anglophone world could do more to engage with practitioners and potential colleagues in this new vibrant and emerging area. There are certainly Western centres that specialize, particularly in Chinese texts and historical documents, but this needs to be extended further if we are not to impose limits on the conversations, synergies and collaborations that can result.";[Mahony, Simon] UCL, UCL Ctr Digital Humanities, Dept Informat Studies, Gower St, London WC1E 6BT, England;Mahony, S (reprint author), UCL, UCL Ctr Digital Humanities, Dept Informat Studies, Gower St, London WC1E 6BT, England.;;Mahony, Simon/0000-0001-9811-9381;;;;19;0;0;2;9;SPRINGER HEIDELBERG;HEIDELBERG;TIERGARTENSTRASSE 17, D-69121 HEIDELBERG, GERMANY;1674-0750;2198-2600;;FUDAN J HUM SOC SCI;Fudan J. Hum. Soc. Sci.;SEP;2018;11;3;;;;;371;388;;10.1007/s40647-018-0216-0;;;18;Social Sciences, Interdisciplinary;Social Sciences - Other Topics;GO2SL;WOS:000439826900007;;Green Published, Other Gold;;;07/02/2020
J;"Bakker, K; Ritts, M";;;;"Bakker, Karen; Ritts, Max";;;Smart Earth: A meta-review and implications for environmental governance;GLOBAL ENVIRONMENTAL CHANGE-HUMAN AND POLICY DIMENSIONS;;;English;Review;;;;;;"Eco-informatics; Environmental governance; Smart earth; Ecology; ICT; IoT; Information and communications technology; Internet of things; Sensors; Digital";"BIG DATA; ARTIFICIAL-INTELLIGENCE; GEOGRAPHIC INFORMATION; POLITICAL-ECONOMY; AIR-POLLUTION; FUTURE; SCIENCE; OPPORTUNITIES; CHALLENGES; SYSTEMS";"Environmental governance has the potential to be significantly transformed by Smart Earth technologies, which deploy enhanced environmental monitoring via combinations of information and communication technologies (ICT), conventional monitoring technologies (e.g. remote sensing), and Internet of Things (IoT) applications (e.g. Environmental Sensor Networks (ESNs)). This paper presents a systematic meta-review of Smart Earth scholarship, focusing our analysis on the potential implications and pitfalls of Smart Earth technologies for environmental governance. We present a meta-review of academic research on Smart Earth, covering 3187 across the full range of academic disciplines from 1997 to 2017, ranging from ecological informatics to the digital humanities. We then offer a critical perspective on potential pathways for evolution in environmental governance frameworks, exploring five key Smart Earth issues relevant to environmental governance: data; real-time regulation; predictive management; open source; and citizen sensing. We conclude by offering suggestions for future research directions and trans-disciplinary conversations about environmental governance in a Smart Earth world.";"[Bakker, Karen; Ritts, Max] Univ Minnesota, Dept Geog, Minneapolis, MN 55455 USA";Bakker, K (reprint author), Univ British Columbia, Dept Geog, 217-1984 West Mall, Vancouver, BC V6T 1Z2, Canada.;;;Social Sciences and Humanities Research Council of CanadaSocial Sciences and Humanities Research Council of Canada (SSHRC);Research assistance from Jessica Hak Hepburn, Donna Liu, Andrea Lucy, and Adele Therias is gratefully acknowledged, as is funding from the Social Sciences and Humanities Research Council of Canada.;;177;6;6;6;16;ELSEVIER SCI LTD;OXFORD;THE BOULEVARD, LANGFORD LANE, KIDLINGTON, OXFORD OX5 1GB, OXON, ENGLAND;0959-3780;1872-9495;;GLOBAL ENVIRON CHANG;Glob. Environ. Change-Human Policy Dimens.;SEP;2018;52;;;;;;201;211;;10.1016/j.gloenvcha.2018.07.011;;;11;"Environmental Sciences; Environmental Studies; Geography";"Environmental Sciences & Ecology; Geography";GZ5FP;WOS:000449444900019;;Other Gold;;;07/02/2020
J;Halstead, H;;;;Halstead, Huw;;;Ask the Assyrians, Armenians, Kurds Transcultural Memory and Nationalism in Greek Historical Discourse on Turkey;HISTORY & MEMORY;;;English;Article;;;;;;"digital humanities; Greek-Turkish relationships; Imbros; Istanbul; memory studies; nationalism; transcultural memory; YouTube";"CULTURAL MEMORY; ISTANBUL";"Recent research has suggested that in the contemporary globalized and digitized world memories transcend national boundaries in a manner that might replace exclusive and antagonistic national histories with inclusive cosmopolitan solidarities. This article critically engages with such models by exploring transcultural cross-referencing in narratives about Greek-Turkish relationships in two different settings: print media produced by memory activists from the expatriated Greek minority of Turkey; and peer-to-peer debates in the ""comments"" section on YouTube. Whilst such transcultural discourses might indeed draw different victim communities closer together, they nevertheless also have the capacity to reinforce national histories and identities.";"[Halstead, Huw] Univ York, Hist, York, N Yorkshire, England; [Halstead, Huw] Univ York, IPUP, York, N Yorkshire, England; [Halstead, Huw] British Sch Athens, Athens, Greece";"Halstead, H (reprint author), Univ York, Hist, York, N Yorkshire, England.; Halstead, H (reprint author), Univ York, IPUP, York, N Yorkshire, England.; Halstead, H (reprint author), British Sch Athens, Athens, Greece.";;;Arts and Humanities Research Council (AHRC);I am grateful to Kostas Arvanitis, Geoffrey Cubitt, Sharon Macdonald, Sebastian Owen, Shane O'Rourke and the two anonymous reviewers from History & Memory for insightful comments and constructive criticism on the research presented in this article. I thank the Constantinopolitan Society, Ekdoseis Tsoukatou, the Ecumenical Federation of Constantinopolitans and the Imvrian Association for providing advice, guidance and access to critical resources. I am indebted to Ekdoseis Tsoukatou for permission to reprint figure 1. This article draws on research that was funded by the Arts and Humanities Research Council (AHRC).;;76;0;0;1;7;INDIANA UNIV PRESS;BLOOMINGTON;601 N MORTON STREET, BLOOMINGTON, IN 47404-3797 USA;0935-560X;1527-1994;;HIST MEM;Hist. Mem.;FAL-WIN;2018;30;2;;;;;3;39;;10.2979/histmemo.30.2.02;;;37;History;History;GR6JD;WOS:000442754700002;;;;;07/02/2020
J;Babb, G;;;;Babb, Genie;;;"Victorian roots and branches: ""The statistical century"" as foundation to the digital humanities";LITERATURE COMPASS;;;English;Article;;;;;;;"FRANCO MORETTI; CULTURE; GENRE; PERIODICALS; DISCOURSE; HISTORY; CHANCE; WAGER";"Victorian Studies and the Digital Humanities (DH) are a natural fit; Victorian texts are in the public domain and thus available for full digitization and subjection to all kinds of applications. This essay focuses on arguably the most controversial: the use of statistical methodologies to analyze literary texts. Often aimed at the ""distant reading"" practices of Franco Moretti, the pros and cons of these methods have been widely debated among literary scholars, but with little reference to their historical roots. Historical accounts of DH have instead focused on technological developments, citing the massive, computerized concordance of the works of Thomas Aquinas, envisioned in 1949 by Father Roberto Busa and realized by IBM over the next 20years, as the moment DH was born. Such accounts, as useful as they are, neglect important connections between the computational methodologies of DH and the emergence of modern statistical methodology during the nineteenth century. The advantage of seeing DH as part of the history of statistics is that it helps us understand and evaluate statistically based DH methodologies in their own terms and not simply as methodologies associated with particular neoliberal institutions in the present. This essay argues that understanding the history of statistics as well as examining current practice helps address the criticisms leveled at computational methodologies and the question of compatibility with traditional humanistic methodologies such as close reading. It begins with a brief history of the emergence of modern statistics in the nineteenth century and the impact on Victorian literature and popular culture and then examines recent DH scholarship that utilizes statistical methodologies to analyze Victorian texts.";[Babb, Genie] SUNY Coll Plattsburgh, English, Plattsburgh, NY 12901 USA;Babb, G (reprint author), SUNY Coll Plattsburgh, Plattsburgh, NY 12901 USA.;;;;;;68;0;0;0;5;WILEY;HOBOKEN;111 RIVER ST, HOBOKEN 07030-5774, NJ USA;1741-4113;;;LIT COMPASS;Lit. Compass;SEP;2018;15;9;;;;;;;e12487;10.1111/lic3.12487;;;14;Literature;Literature;GT5JI;WOS:000444543300001;;;;;07/02/2020
J;Candel, D;;;;Candel, Daniel;;;A report on the reports of the stanford literary lab: A reason why the digital humanities may find it difficult to change literary history;SEMIOTICA;;;English;Article;;;;;;"digital humanities; literary history; literary semantics; modal logic";;The present article studies eight of the twelve reports of the Stanford Literary Lab (SLL) to understand why the revolutionary practices of the lab, and by extension of the digital humanities, have not yet changed literary history, as the lab itself admits. The article examines the reports with two related culturalsemantic tools, each of which is introduced via the Pixar movie Brave. First, the interpretations of the reports are placed within a basic semantic grid organized into four quadrants by a nature-society axis and a past-present axis, which shows that the interpretations are invariably situated in the present-society quadrant. This analysis, while necessary, merely proves that SLL operates within a certain cultural climate. The real test lies in ascertaining whether this cultural climate affects the interpretation of novel data. To do so, the article looks for the reaction of SLL to novel data in two reports. The reports are shown to domesticate novelty by explaining it through standard alethic/deontic patterns, even though the data are novel precisely because the patterns largely fail to explain them. The article closes by asking whether such patterns limit or enable thinking and what this means for the digital humanities.;[Candel, Daniel] Univ Alcala De Henares, Modern Languages, Alcala De Henares, Spain;Candel, D (reprint author), Univ Alcala De Henares, Modern Languages, Alcala De Henares, Spain.;;;;;;54;0;0;4;13;WALTER DE GRUYTER GMBH;BERLIN;GENTHINER STRASSE 13, D-10785 BERLIN, GERMANY;0037-1998;1613-3692;;SEMIOTICA;Semiotica;SEP;2018;;224;;;;;111;134;;10.1515/sem-2016-0223;;;24;"Humanities, Multidisciplinary; Social Sciences, Interdisciplinary";"Arts & Humanities - Other Topics; Social Sciences - Other Topics";GS1DN;WOS:000443255800005;;;;;07/02/2020
J;Baranda, N;;;;Baranda, Nieves;;;Studying Early Modern Women Writers: The Digital Humanities Turn;EARLY MODERN WOMEN-AN INTERDISCIPLINARY JOURNAL;;;English;Article;;;;;;;;;[Baranda, Nieves] Univ Nacl Educ Distancia, Spanish Literature, Madrid, Spain;Baranda, N (reprint author), Univ Nacl Educ Distancia, Spanish Literature, Madrid, Spain.;;;;;;13;2;2;0;3;UNIV MARYLAND-CTR RENAISSANCE & BAROQUE STUD;COLLEGE PARK;UNIV MARYLAND, 0139 TALIAFERRO HALL, COLLEGE PARK, MD 20742 USA;1933-0065;;;EARLY MOD WOMEN;Early Mod. Women;FAL;2018;13;1;;;;;163;171;;10.1353/emw.2018.0059;;;9;Humanities, Multidisciplinary;Arts & Humanities - Other Topics;HB1MS;WOS:000450787900013;;;;;07/02/2020
