PT;AU;BA;BE;GP;AF;BF;CA;TI;SO;SE;BS;LA;DT;CT;CY;CL;SP;HO;DE;ID;AB;C1;RP;RI;OI;FU;FX;CR;NR;TC;Z9;U1;U2;PU;PI;PA;SN;EI;BN;J9;JI;PD;PY;VL;IS;PN;SU;SI;MA;BP;EP;AR;DI;D2;EA;PG;WC;SC;GA;UT;PM;OA;HC;HP;DA
J;Wang, Q;;;;Wang, Qing;;;Distribution features and intellectual structures of digital humanities A bibliometric analysis;JOURNAL OF DOCUMENTATION;;;English;Article;;;;;;"Library and information services; Digital humanities; VOSviewer; CiteSpace; Digital cultural heritage; Digital history; Digital literary; Humanities computing; Visualization analysis";"VISUALIZATION ANALYSIS; CULTURAL-HERITAGE; EMERGING TRENDS; CO-WORD; HISTORY; COLLECTIONS; LITERARY; TOOLS; PUBLICATIONS; UNIVERSITY";"Purpose - The purpose of this paper is to conduct a retrospective bibliometric analysis of documents about digital humanities, an emerging but interdisciplinary movement. It examines the distribution of research outputs and languages, identifies the active journals and institutions, dissects the network of categories and cited references, and interprets the hot research topics. Design/methodology/approach - The source data are derived from the Web of Science (WoS) core collection. To reveal the holistic landscape of this field, VOSviewer and CiteSpace as popular visualization tools are employed to process the bibliographic data including author, category, reference, and keyword. Furthermore, the parameter design of the visualization tools follows the general procedures and methods for bibliometric analysis. Findings - There is an obviously rapid growth in digital humanities research. English is still the leading academic language in this field. The most influential authors all come from or have scientific relationships with Europe and North America, and two leading countries of which are the UK and USA. Digital humanities is the result of a dynamic dialogue between humanistic exploration and digital means. This research field is closely associated with history, literary and cultural heritage, and information and library science. Research limitations/implications - This analysis relies on the metadata information extracted from the WoS database; however, some valuable literatures in the field of digital humanities may not be retrieved from the database owing to the inherent challenge of topic search. This study is also restricted by the scope of publications, the limitation regarding the source of data is that WoS database may have underrepresented publications in this domain. Originality/value - The output of this paper could be a valuable reference for researchers and practitioners interesting in the knowledge domain of digital humanities. Moreover, the conclusions of this retrospective analysis can be deemed as the comparable foundation for future study.";[Wang, Qing] Nankai Univ, Business Sch, Dept Informat Resource Management, Tianjin, Peoples R China;Wang, Q (reprint author), Nankai Univ, Business Sch, Dept Informat Resource Management, Tianjin, Peoples R China.;;;;;;97;4;4;27;160;EMERALD GROUP PUBLISHING LTD;BINGLEY;HOWARD HOUSE, WAGON LANE, BINGLEY BD16 1WA, W YORKSHIRE, ENGLAND;0022-0418;1758-7379;;J DOC;J. Doc.;;2018;74;1;;;;;223;246;;10.1108/JD-05-2017-0076;;;24;"Computer Science, Information Systems; Information Science & Library Science";"Computer Science; Information Science & Library Science";FR6QP;WOS:000419191300012;;;;;07/02/2020
J;"Poole, AH; Garwood, DA";;;;"Poole, Alex H.; Garwood, Deborah A.";;;Natural allies: Librarians, archivists, and big data in international digital humanities project work;JOURNAL OF DOCUMENTATION;;;English;Article;;;;;;"Collaboration; Interdisciplinarity; Digital humanities; Data management; Digital curation; Data curation; Information and library science";"RESEARCH DATA-MANAGEMENT; QUALITATIVE RESEARCH; COLLABORATION; SERVICES";"Purpose In Digging into Data 3 (DID3) (2014-2016), ten funders from four countries (the USA, Canada, the UK, and the Netherlands) granted $5.1 million to 14 project teams to pursue data-intensive, interdisciplinary, and international digital humanities (DH) research. The purpose of this paper is to employ the DID3 projects as a case study to explore the following research question: what roles do librarians and archivists take on in data-intensive, interdisciplinary, and international DH projects? Design/methodology/approach Participation was secured from 53 persons representing eleven projects. The study was conducted in the naturalistic paradigm. It is a qualitative case study involving snowball sampling, semi-structured interviews, and grounded analysis. Findings Librarians or archivists were involved officially in 3 of the 11 projects (27.3 percent). Perhaps more importantly, information professionals played vital unofficial roles in these projects, namely as consultants and liaisons and also as technical support. Information and library science (ILS) expertise helped DID3 researchers with issues such as visualization, rights management, and user testing. DID3 participants also suggested ways in which librarians and archivists might further support DH projects, concentrating on three key areas: curation, outreach, and ILS education. Finally, six directions for future research are suggested. Originality/value Much untapped potential exists for librarians and archivists to collaborate with DH scholars; a gap exists between researcher awareness and information professionals' capacity.";"[Poole, Alex H.] Drexel Univ, Dept Informat Sci, Philadelphia, PA 19104 USA; [Garwood, Deborah A.] Drexel Univ, Coll Comp & Informat, Philadelphia, PA 19104 USA";Poole, AH (reprint author), Drexel Univ, Dept Informat Sci, Philadelphia, PA 19104 USA.;Garwood, Deborah A/M-2040-2018;Garwood, Deborah A/0000-0003-0279-0600;;;;110;5;5;25;72;EMERALD GROUP PUBLISHING LTD;BINGLEY;HOWARD HOUSE, WAGON LANE, BINGLEY BD16 1WA, W YORKSHIRE, ENGLAND;0022-0418;1758-7379;;J DOC;J. Doc.;;2018;74;4;;;;;804;826;;10.1108/JD-10-2017-0137;;;23;"Computer Science, Information Systems; Information Science & Library Science";"Computer Science; Information Science & Library Science";GE7IV;WOS:000431407700007;;;;;07/02/2020
J;"Cullen, D; Bell, A";;;;"Cullen, Darcy; Bell, Allan";;;The Social Text and Networked Knowledge: New Modes of Scholarly Book Publishing in Indigenous Studies;JOURNAL OF SCHOLARLY PUBLISHING;;;English;Article;;;;;;"scholarly communication; press-library collaborations; Indigenous studies; digital publishing";;"Initiatives in the digital humanities; advances in library, archiving, and information sciences; and innovative First Nations community-based language and cultural heritage projects demand that the scholarly communications infrastructure evolve to improve access to and mobilize knowledge in its written, oral, and visual forms. The field of Indigenous studies raises interesting challenges and opportunities for multimodal publishing and for new kinds of partnerships to support research and publication. This paper discusses the collaborative efforts of the University of British Columbia Press, University of British Columbia Library, and University of Washington Press to develop a dynamic new resource for Indigenous research, education, and cultural programs, which places the scholarly book at its centre. It considers the changing nature of scholarly publishing, the expanding definition of the scholarly record, and the specific context of cultural heritage projects.";"[Cullen, Darcy] Univ Toronto, Toronto, ON, Canada; [Bell, Allan] Univ Brit Columbia Lib, Columbia, MO USA";Cullen, D (reprint author), Univ Toronto, Toronto, ON, Canada.;;Bell, Allan/0000-0003-1563-8923;;;;36;0;0;4;29;UNIV TORONTO PRESS INC;TORONTO;JOURNALS DIVISION, 5201 DUFFERIN ST, DOWNSVIEW, TORONTO, ON M3H 5T8, CANADA;1198-9742;1710-1166;;J SCHOLARLY PUBL;J. Sch. Publ.;JAN;2018;49;2;;;;;193;212;;10.3138/jsp.49.2.193;;;20;"Humanities, Multidisciplinary; Information Science & Library Science";"Arts & Humanities - Other Topics; Information Science & Library Science";FS0FH;WOS:000419448800005;;Bronze;;;07/02/2020
J;Smiraglia, RP;;;;Smiraglia, Richard P.;;;ISKO 15's Bookshelf: Dispersion in a Digital Age-An Editorial;KNOWLEDGE ORGANIZATION;;;English;Editorial Material;;;;;;"ISKO international conference; knowledge organization; citations; references";KNOWLEDGE ORGANIZATION;"The Fifteenth International ISKO Conference (ISKO 15) took place in Porto, Portugal in early July 2018 at the Faculty of Arts and Humanities of the University of Porto, Department of Communication and Information Sciences. The main theme was "" challenges and opportunities for knowledge organization in the digital age;"" three sub- themes were: foundations and methods, interoperability and societal challenges. A feature of the conference was a special session devoted to the memory of ISKO founder Ingetraut Dahlberg. The proceedings contain 105 formal research papers as well as abstracts for fourteen posters and two workshops. Informetric analyses produce a characteristic picture for an international ISKO conference, with core concepts of KO and KOSs embracing digital age concepts of social media and the semantic web alongside new library conceptual data models. On ISKO 15' s bookshelf were articles by Hjorland, Dahlberg, Tennis and Beghtol, and books by Ranganathan and Szostak, Gnoli and Lopez- Huertas. But also books by Adler, Garcia Gutierrez, Holland and Verborgh and FRBR/ LRM were present as were articles by Adler, Kleineberg and Gruber. Core ISKO is joined on this bookshelf by new articles from the ISKO Encyclopedia, by works pointing toward ethical approaches to KO, and by works pointing toward KO for a semantic web- challenges and opportunities for KO, as the conference theme indicated.";[Smiraglia, Richard P.] Univ Wisconsin Milwaukee, Sch Informat Studies, 2025 E Newport, Milwaukee, WI 53211 USA;Smiraglia, RP (reprint author), Univ Wisconsin Milwaukee, Sch Informat Studies, 2025 E Newport, Milwaukee, WI 53211 USA.;;;;;;9;1;1;3;14;ERGON-VERLAG;WURZBURG;GROMBUHLSTR 7, 97080 WURZBURG, GERMANY;0943-7444;;;KNOWL ORGAN;Knowl. Organ.;;2018;45;5;;;;;343;357;;10.5771/0943-7444-2018-5-343;;;15;Information Science & Library Science;Information Science & Library Science;GU7LJ;WOS:000445503700001;;;;;07/02/2020
J;"Betiang, L; Akpan, B";;;;"Betiang, Liwhu; Akpan, Brenda";;;The African Writer at Digital Cross-Roads: A Preliminary Interrogation of Literary Production in Nigeria/the Global South within 21st Century Media Convergence;KOME-AN INTERNATIONAL JOURNAL OF PURE COMMUNICATION INQUIRY;;;English;Article;;;;;;"Media Globalization; Digital Humanities; Cultural Production; Digital/Electronic Divide; Nigeria; Global South";;"The 21st century convergence of media through technological, industry and market conflations has altered the traditional work environment of the creative writer in Africa and the Global South due principally to problems/issues of digital divide/negotiation or migration which have altered modes/technologies for the creation, production, distribution, and consumption of letters. The global visibility of the African writer, like many academics in African universities, is challenged by digital migration, digital illiteracy or aliteracy. This study problematizes this digital exclusion from the contemporary digital world on account of the multiple dimensions of digital divide; and social and intellectual denial of access to the global literary forum. This preliminary study re-articulates the Nigerian writer's creative environment, production process and distribution of the literary product; using interviews, ethnographic interactions, and observations, to assess the writers' (n: 62) digital literacy, competence, and issues of digital migration. Findings which were analyzed descriptively preliminarily point to the fact that media digitization actually challenges the Nigerian writer in ways that have impacted on his/her competence for literary creation/production, access and distribution within the 'global literary forum'; a situation that may probably be seen as a common disempowering' experience for many creative writers in developing Global South.";"[Betiang, Liwhu; Akpan, Brenda] Univ Calabar, Dept Theatre Film & Carnival Studies, Calabar, Nigeria";Betiang, L (reprint author), Univ Calabar, Dept Theatre Film & Carnival Studies, Calabar, Nigeria.;Betiang, Liwhu -/W-7747-2019;;;;;56;1;1;1;1;HUNGARIAN COMMUNICATION STUDIES ASSOC;BUDAPEST;BOKOR UTCA 1-3-5, BUDAPEST, 1037, HUNGARY;2063-7330;;;KOME;KOME;;2018;6;1;;;;;14;31;;10.17646/KOME.2018.12;;;18;Communication;Communication;GK9CK;WOS:000436534500002;;DOAJ Gold, Green Accepted;;;07/02/2020
J;"Chiu, CC; Lee, LC";;;;"Chiu, Chen-Chiou; Lee, Lai-Chung";;;System satisfaction survey for the App to integrate search and augmented reality with geographical information technology;MICROSYSTEM TECHNOLOGIES-MICRO-AND NANOSYSTEMS-INFORMATION STORAGE AND PROCESSING SYSTEMS;;;English;"Article; Proceedings Paper";IEEE International Conference on Applied System Innovation (IEEE ICASI);MAY 26-JUN 01, 2016;Fuzhou Univ, Okinawa, JAPAN;Taiwanese Inst Knowledge Innovat, Inst Elect & Elect Engineers, Sci Educ Ctr, Natl Formosa Univ, Chia Nan Univ Pharmacy & Sci, Kun Shan Univ, S Taiwan Univ Sci & Technol, St. Johns Univ, Natl United Univ, Univ Ryukyus, Kongju Natl Univ, Hannam Univ, Jimei Univ, iVAN Technol Enterprise Grp, IEEE Tainan Sect, Fujian Informat Ind Assoc, Fuzhou Cross Strait Ind Design Creat Park;Fuzhou Univ;;;"Digital humanities are unfamiliar words in Taiwan. With the popularity of digital technology and mobile computing, Digital Human Geography in both theory and practice have emerged many new potentials and development opportunities. However, the research field regarding digital human geography can cover many areas, such as: mobile augmented reality, local media and service design, urban space interaction, virtual mixed space, space humanistic experience, historical materials reproduction, creativity of digital local sense, cultural narrative and art experience, local action games, mobile learning, and location-related business applications etc. This study aims to transfer information to specific groups through a simple and straightforward manner. With digital technology in combination with humane digital contents, people under the scenario of interactive interface are allowed to apply geographic information system (GIS) and geo-fencing program to convert data into visual images and through today's Infographics to clearly use visual design characteristics in content presentation. Therefore, our study was to develop a new App, called ""Ai Guang Zhan"". People can use ""Ai Guang Zhan"" App to integrate all exhibition related services. The App can be downloaded from smartphone or tablet PC for users to search in any time the arts and cultural activities and public facilities in the nearest place and receive instant mobile navigation services among various cultural and creative parks. To understand the preference and satisfaction by the people who use the UI interface for the APP designed from the study, a random questionnaire survey will be conducted in Huashan Cultural and Creative Industry Park and Songshan Cultural and Creative Park. The survey results will be used as reference for function improvement of next APP version. The primary purpose of this research is to propose a model for the development of applications, as well as methods for a clearer and easier visual presentation of information to be used as a reference for practitioners or application designers. The application, developed by the study through the proposed processes, was found to be effective; the developed application could be utilized as a new and useful tool to facilitate the utilization of academic and cultural resources. Additionally, users' specific comments and suggestions collected by the study could be adopted as a reference for future application development. The application developed by this study was found to serve effectively as a method to promote the development of art and cultural activities of all sizes in various regions, and stimulate the exchange of arts and humanities between urban and rural areas. Furthermore, the application has the ability to attract younger people to participate in art and cultural activities, find their own interests, and explore more corresponding activities with its assistance. Future applications associated to art and cultural activities are suggested to effectively integrate AR, GIS, and visual design (such as Infographics) technologies, and thereby offer users more diversified, convenient, and useful functions. Restricted by the resources of labor and limited time, the functional design and development of the application still requires improvement. Specifically, the combination of AR technology and information presentation of art and cultural activities, as well as the calculation of relative distance and travel time were not presented effectively. The next step of the project would involve revising the content and functionalities of the application based on users' feedback collected by this study, reviewing the acceptance of market responses of the application, and seeking a development company or foundation for technology transfer. Moreover, we intend to combine more technologies such as diversified cross-platform functions, visualized design of information, and interactive devices to further improve the application, and thereby stimulate social, human, and geographical interactions.";"[Chiu, Chen-Chiou; Lee, Lai-Chung] Natl Taipei Univ Technol, 1,Sec 3,Zhongxiao E Rd, Taipei 10608, Taiwan";Lee, LC (reprint author), Natl Taipei Univ Technol, 1,Sec 3,Zhongxiao E Rd, Taipei 10608, Taiwan.;;;"Humanities Department of the Ministry of Science and Technology;  [MOST 104-2420-H-027-003]";With grateful to the Humanities Department of the Ministry of Science and Technology and the Granted Program No. is MOST 104-2420-H-027-003.;;20;3;3;5;35;SPRINGER;NEW YORK;233 SPRING ST, NEW YORK, NY 10013 USA;0946-7076;1432-1858;;MICROSYST TECHNOL;Microsyst. Technol.;JAN;2018;24;1;;;SI;;319;341;;10.1007/s00542-017-3333-9;;;23;"Engineering, Electrical & Electronic; Nanoscience & Nanotechnology; Materials Science, Multidisciplinary; Physics, Applied";"Engineering; Science & Technology - Other Topics; Materials Science; Physics";FT7GL;WOS:000423320800036;;;;;07/02/2020
J;Elmborg, J;;;;Elmborg, James;;;Toward Building a Digital Index of Little Magazines of the 1960s;SERIALS REVIEW;;;English;Article;;;;;;"digital humanities; little magazine; digital archive; mimeograph revolution";;The rich history of the mimeograph revolution era of the 1960s presents distinct rewards and challenges to both literary scholars and librarians. The ephemeral nature of the great majority of mimeograph revolution publications has rendered invisible their contributors and their literary works. One potential solution to this problem lies in the creation of a little magazine database, which has been under development by the author.;[Elmborg, James] Univ Alabama, Sch Lib & Informat Studies, Tuscaloosa, AL USA;Elmborg, J (reprint author), Univ Alabama, Sch Lib & Informat Studies, Gorgas Lib 513, Tuscaloosa, AL 35487 USA.;;;;;;12;1;1;1;9;ROUTLEDGE JOURNALS, TAYLOR & FRANCIS LTD;ABINGDON;2-4 PARK SQUARE, MILTON PARK, ABINGDON OX14 4RN, OXON, ENGLAND;0098-7913;1879-095X;;SERIALS REV;Ser. Rev.;;2018;44;1;;;SI;;16;23;;10.1080/00987913.2018.1437320;;;8;Information Science & Library Science;Information Science & Library Science;GA8OA;WOS:000428598400004;;;;;07/02/2020
J;Craft, AR;;;;Craft, Anna R.;;;Digital Scholarship Planning: A Perspective on the CNI-ARL Workshop;SERIALS REVIEW;;;English;Article;;;;;;"academic libraries; digital humanities; digital projects; digital scholarship; library spaces; research support";;"The CNI-ARL Digital Scholarship Planning Workshop at Brown University, November 8-10, 2017, was an intensive, focused workshop for institutions at all stages of the digital scholarship planning process. This report, based on one participant's experience, touches on some of the highlights and takeaways from the sessions, which focused on campus needs and partnerships; staffing; governance and funding models; the applications of library and other content collections in teaching, learning, and research; student roles in digital scholarship; space and place; and the institutionalization of digital scholarship. A fundamental concept of the workshop was the acknowledgement of the wide variety of models and services digital scholarship can encompass and the critical need for each institution to pursue digital scholarship services that are in line with its strengths and the needs of its particular constituencies.";[Craft, Anna R.] Univ North Carolina Greensboro, Coordinator Metadata Serv, Univ Lib, Greensboro, NC USA;Craft, AR (reprint author), Univ North Carolina Greensboro, Coordinator Metadata Serv, UNCG Univ Lib, POB 26170, Greensboro, NC 27402 USA.;Craft, Anna R./AAD-5509-2019;Craft, Anna R./0000-0002-9774-4027;;;;15;0;0;2;25;ROUTLEDGE JOURNALS, TAYLOR & FRANCIS LTD;ABINGDON;2-4 PARK SQUARE, MILTON PARK, ABINGDON OX14 4RN, OXON, ENGLAND;0098-7913;1879-095X;;SERIALS REV;Ser. Rev.;;2018;44;1;;;SI;;64;70;;10.1080/00987913.2018.1433930;;;7;Information Science & Library Science;Information Science & Library Science;GA8OA;WOS:000428598400011;;;;;07/02/2020
J;Sterman, J;;;;Sterman, John;;;System dynamics at sixty: the path forward;SYSTEM DYNAMICS REVIEW;;;English;Article;;;;;;;"DIFFERENTIAL EVOLUTION; NETWORK STRUCTURE; MODEL; MANAGEMENT; VALIDATION; MISPERCEPTIONS; INFORMATION; ERADICATION; SIMULATION; COMPLEXITY";The late Jay Forrester founded the field of system dynamics 60years ago. On this anniversary I ask what lessons his remarkable life of innovation and impact hold for the field. From a Nebraska ranch to MIT, servomechanisms, digital computing and system dynamics, Jay lived his entire life on the frontier, innovating to solve critical problems. Today, more than ever, humanity faces grave threats arising from our mismanagement of increasingly complex systems. Fortunately, progress in system dynamics, the natural and social sciences, computing, data availability, and other modeling disciplines have advanced the frontier in theory and methods to build reliable, useful knowledge of complex systems. We must therefore ask: What would Jay do if he were young today? How would he build on the knowledge, technology, data and methods now available to improve the science and practice of system dynamics? What must we now do to explore the next frontier? (c) 2018 System Dynamics Society;"[Sterman, John] MIT, Sloan Sch Management, Management, Cambridge, MA 02142 USA; [Sterman, John] MIT, Syst Dynam Grp, Cambridge, MA 02142 USA";Sterman, J (reprint author), MIT, Sloan Sch Management, Syst Dynam Grp, 100 Main St,E62-436, Cambridge, MA 02142 USA.;;;;;;129;15;16;13;30;WILEY;HOBOKEN;111 RIVER ST, HOBOKEN 07030-5774, NJ USA;0883-7066;1099-1727;;SYST DYNAM REV;Syst. Dyn. Rev.;JAN-JUN;2018;34;01-Feb;;;SI;;5;47;;10.1002/sdr.1601;;;43;"Management; Social Sciences, Mathematical Methods";"Business & Economics; Mathematical Methods In Social Sciences";GW0OE;WOS:000446566100001;;;;;07/02/2020
J;Akca, S;;;;Akca, Sumeyye;;;Digital Humanities: A New Approach;TURKISH LIBRARIANSHIP;;;Turkish;Article;;;;;;"Digital humanities; cultural heritage; librarianship; information and record management";LIBRARIES;The advancement in digitalization and computer technology has given innovative view to the cultural heritage sector. With the impact of globalization, it has become compulsory to increase access to cultural heritage, to ensure participation and to evaluate practices from an international perspective. All these developments contributed to the formation of a new field, approach, in the name of digital humanities. With the studies done in this area, it is possible to have knowledge and interaction with a cultural entity that exists today in any part of the world. While creating the department of this field in the world's leading universities, in Turkey this concept has not been yet known. Although in recent years, there has been an increase in the number of digitalization of cultural heritage by cultural memory institutions, studies carried out within the scope of digital humanities are scarce. Based on this problem, it is aimed to introduce the field by describing what the digital humanities is, what it expresses, its historical development and application areas in the context of the literature in this study. Also studies done in this field in Turkey are evaluated and approaches and practices about convergence with digital humanities and librarianships around the world has been mentioned.;[Akca, Sumeyye] Ardahan Univ, Dept Informat Management, Ardahan, Turkey;Akca, S (reprint author), Ardahan Univ, Dept Informat Management, Ardahan, Turkey.;;;;;;60;0;0;0;0;TURKISH LIBRARIANS ASSOC;ANKARA;YENISEHIR, NECATIBEY CAD, ELGIN SOK, PO BOX 175, ANKARA, 06440, TURKEY;1300-0039;2147-9682;;TURK LIBRARIANSH;Turk. Librariansh.;;2018;32;3;;;;;193;207;;10.24146/tkd.2018.37;;;15;Information Science & Library Science;Information Science & Library Science;HE1YR;WOS:000453070400006;;DOAJ Gold;;;07/02/2020
